{
  "id": "trek-x-japan",
  "name": "TREK × Japan",
  "author": "fbnlrz",
  "description": "Collaborative in-trip Japan hub",
  "repo": "fbnlrz/trek-x-japan",
  "type": "trip-page",
  "icon": "Compass",
  "versions": [
    {
      "version": "4.0.0",
      "gitTag": "v4.0.0",
      "commitSha": "438d7477a2b24f43c1ed7eec4f3dacc8956e2c13",
      "downloadUrl": "https://github.com/fbnlrz/trek-x-japan/releases/download/v4.0.0/plugin.zip",
      "sha256": "a57e6b2d02d18071169dc0b5760bf63752fcb1c7d2d50661a3dd0b4f508efe60",
      "trek": ">=4.0.0 <5.0.0",
      "size": 202821,
      "apiVersion": 1,
      "nativeModules": false,
      "publishedAt": "2026-08-27T14:47:33.676Z",
      "signature": "RHoDfoV5ajNDXx2abCg8LnmqjYgIcP6Z8chRhaOzhFntPxoGN3HsoharqzMGYGAz1nmvlH7PMAD3VsGuMUMRAg=="
    },
    {
      "version": "1.2.0",
      "gitTag": "v1.2.0",
      "commitSha": "df8c977e42b1bad85f4afae78820490f64f05f77",
      "downloadUrl": "https://github.com/fbnlrz/trek-x-japan/releases/download/v1.2.0/plugin.zip",
      "sha256": "5ba9a187c3fa5c5721a943b84b39eca96383ef0331cc73bc944f30bf5f2a0562",
      "trek": ">=3.2.1 <4.0.0",
      "minTrekVersion": "3.2.1",
      "size": 79830,
      "apiVersion": 1,
      "nativeModules": false,
      "publishedAt": "2026-07-07T12:47:58.000Z",
      "signature": "SVeFzdzSH5bMds4I9geO/TcKCADlDT+d5qIim85y6B/l0WV42D7RzSqqOMyuB/iGUwyozKDcWwEj3XZ5ktWoDw=="
    },
    {
      "version": "1.0.0",
      "gitTag": "v1.0.0",
      "commitSha": "2fc6d0d5c96411da2c20d52a87a3342ac8f989ad",
      "downloadUrl": "https://github.com/fbnlrz/trek-x-japan/releases/download/v1.0.0/plugin.zip",
      "sha256": "2fa3530fc2811c1ac69aca7678cb9adde76d936655b5fe89c2e8d0e06356576e",
      "trek": ">=3.2.1 <4.0.0",
      "minTrekVersion": "3.2.1",
      "size": 54581,
      "apiVersion": 1,
      "nativeModules": false,
      "publishedAt": "2026-07-06T00:14:58.028Z",
      "signature": "OmscztHROD/KA53hbtZtug8/VSlATv/ldPtjZ1Usk/eGDr312F1UPBbS4ASAry+BMOHroTSWx8RM2+nWGQwdBA=="
    }
  ],
  "homepage": "https://github.com/fbnlrz/trek-x-japan",
  "reviewedAt": "2026-08-27",
  "boundOwner": "fbnlrz",
  "authorPublicKey": "DJDfduAyHs2Ja/xhOyMkbCAcreMZZyKuz70PqTyfYM0="
}
