{
  "id": "trek-gotify",
  "name": "Gotify",
  "author": "jubnl",
  "description": "Deliver your TREK notifications to a self-hosted Gotify server.",
  "repo": "jubnl/trek-gotify",
  "type": "integration",
  "icon": "Bell",
  "versions": [
    {
      "version": "1.0.2",
      "gitTag": "v1.0.2",
      "commitSha": "203e1599b0c18552ed2605de532ba88f22931406",
      "downloadUrl": "https://github.com/jubnl/trek-gotify/releases/download/v1.0.2/plugin.zip",
      "sha256": "8e9075da6fb82ff405c11f63d6c0301db88e6331fb006dcc05d30ae2129ed8af",
      "trek": ">=3.3.0 <5.0.0",
      "size": 6761,
      "apiVersion": 1,
      "nativeModules": false,
      "publishedAt": "2026-08-24T18:01:43.411Z",
      "operatorEgress": true,
      "signature": "a1EVgQaAnJ8jESqPk3tmQsupbV44K7rDB5y/rpB+MKAtmXenOXqYMLwY7jSBewmMFDSsK5/4nPu6rkD+Xs85Bw=="
    },
    {
      "version": "1.0.1",
      "gitTag": "v1.0.1",
      "commitSha": "eeb325ea6b5d1f89bf257e8437319877e3a3fe5d",
      "downloadUrl": "https://github.com/jubnl/trek-gotify/releases/download/v1.0.1/plugin.zip",
      "sha256": "07af2f7c3be8ad28a0dc763069ad6bd2cb8a8a4841f828ae0010bea58b482923",
      "trek": ">=3.3.0 <4.0.0",
      "size": 6760,
      "apiVersion": 1,
      "nativeModules": false,
      "publishedAt": "2026-07-19T11:17:23.448Z",
      "operatorEgress": true,
      "signature": "d0PkHKB+7JI7uuPGjfYSMpPcUNq3s79/96qK82HuW/DVc1D2ce0GcYvbvagmxaE5vH6LyvsNcXDHJxhatQnfBQ=="
    },
    {
      "version": "1.0.0",
      "gitTag": "v1.0.0",
      "commitSha": "628aa6b0b647c5357391ebe00d3df013ae1e8138",
      "downloadUrl": "https://github.com/jubnl/trek-gotify/releases/download/v1.0.0/plugin.zip",
      "sha256": "4790b777c68921615405013dab51eaf29b2050081280f2b9d6ee139e441d07e3",
      "trek": ">=3.3.0 <4.0.0",
      "minTrekVersion": "3.3.0",
      "size": 5622,
      "apiVersion": 1,
      "nativeModules": false,
      "publishedAt": "2026-07-11T20:50:38.986Z",
      "operatorEgress": true,
      "signature": "DcLKNRGZTuUv1CoEi7OLCt0oFZItzaTSqzE4mAPlzZhzE7ioNEZa9Ckd/X1f+L3zsfctKTH6UVCd0t7a6yCcCA=="
    }
  ],
  "homepage": "https://github.com/jubnl/trek-gotify",
  "authorPublicKey": "YgFVo9ES55xz9m0/0Thh5sgx/IlVaaU2r0hScEawgiA=",
  "reviewedAt": "2026-08-24",
  "boundOwner": "jubnl"
}
