{
  "id": "trip-research",
  "name": "Trip Research",
  "author": "raduwolf12",
  "description": "All-in-one trip research: visa requirements, public holidays, weather, duty-free limits, and group luggage rules — auto-populated from your trip.",
  "repo": "raduwolf12/trip-research",
  "type": "trip-page",
  "versions": [
    {
      "version": "1.1.1",
      "gitTag": "v1.1.1",
      "commitSha": "2b1bcad9d2790daf9cc55c4c534ead568b29f33b",
      "downloadUrl": "https://github.com/raduwolf12/trip-research/releases/download/v1.1.1/plugin.zip",
      "sha256": "eabc0d35018560027f7816d069f4cbbb13152f90824a65f65659630aa5fae476",
      "trek": ">=3.3.0 <4.1.0",
      "size": 75103,
      "apiVersion": 1,
      "nativeModules": false,
      "publishedAt": "2026-08-18T15:49:25.596Z"
    },
    {
      "version": "1.1.0",
      "gitTag": "v1.1.0",
      "commitSha": "7019442450aeb9bc59e87d8ca279cb7eb6ffb984",
      "downloadUrl": "https://github.com/raduwolf12/trip-research/releases/download/v1.1.0/plugin.zip",
      "sha256": "350cff08766be67de64765dee5ba2a6c74cbd7bc981d9e938888aadf1bd01f2a",
      "trek": ">=3.3.0 <4.0.0",
      "size": 75102,
      "apiVersion": 1,
      "nativeModules": false,
      "publishedAt": "2026-07-23T17:33:02.537Z"
    },
    {
      "version": "1.0.4",
      "gitTag": "v1.0.4",
      "commitSha": "fddadf0e205c0952aaf210d3112764b5bb9939b6",
      "downloadUrl": "https://github.com/raduwolf12/trip-research/releases/download/v1.0.4/plugin.zip",
      "sha256": "4590b4ca8308ab574355f2aa1897e7b3ef3f58d8b9a1deb6474f01589a777588",
      "trek": ">=3.3.0 <4.0.0",
      "size": 66562,
      "apiVersion": 1,
      "nativeModules": false,
      "publishedAt": "2026-07-20T20:43:04.144Z"
    }
  ],
  "icon": "Globe",
  "homepage": "https://github.com/raduwolf12/trip-research",
  "reviewedAt": "2026-08-20",
  "boundOwner": "raduwolf12"
}
