{
  "id": "featured-guides",
  "name": "Featured Guides",
  "author": "raduwolf12",
  "description": "Curated destination guides enriched with real places to explore, with one-tap add straight into your trip.",
  "repo": "raduwolf12/featured-guides",
  "type": "page",
  "versions": [
    {
      "version": "1.4.0",
      "gitTag": "v1.4.0",
      "commitSha": "7949c92d7fc5340ce9b866b34126f5b1a1cc3323",
      "downloadUrl": "https://github.com/raduwolf12/featured-guides/releases/download/v1.4.0/plugin.zip",
      "sha256": "58722e5ac69b47dc50ac1d9c266febce31626372b8379adbcd5a3e5171809a6b",
      "trek": ">=3.4.0 <4.0.0",
      "size": 571733,
      "apiVersion": 1,
      "nativeModules": false,
      "publishedAt": "2026-08-03T21:54:38.827Z"
    },
    {
      "version": "1.3.0",
      "gitTag": "v1.3.0",
      "commitSha": "2430480ac3fcc09256615abea2571216992f73a6",
      "downloadUrl": "https://github.com/raduwolf12/featured-guides/releases/download/v1.3.0/plugin.zip",
      "sha256": "f00203484deff3ae3c2a23713ed12b1f7cbc6f7cd1568e8dfd4533af9cbac743",
      "trek": ">=3.4.0 <4.0.0",
      "size": 563572,
      "apiVersion": 1,
      "nativeModules": false,
      "publishedAt": "2026-07-27T19:43:30.799Z"
    },
    {
      "version": "1.1.0",
      "gitTag": "v1.1.0",
      "commitSha": "07d43655fde1079741d73cdfe32fda29c5fecf51",
      "downloadUrl": "https://github.com/raduwolf12/featured-guides/releases/download/v1.1.0/plugin.zip",
      "sha256": "61c0e9a1ecbfea1691f61de5e01b6b941e020c65df67aad2366dff134cf21853",
      "trek": ">=3.4.0 <4.0.0",
      "size": 557734,
      "apiVersion": 1,
      "nativeModules": false,
      "publishedAt": "2026-07-22T00:12:07.072Z"
    }
  ],
  "icon": "Compass",
  "reviewedAt": "2026-08-08",
  "boundOwner": "raduwolf12"
}
