{
  "id": "wiki-place-context",
  "name": "Wikipedia Place Context",
  "author": "raduwolf12",
  "description": "Shows nearby Wikipedia articles right inside a place's detail view. Search once to link a location, then it's remembered for that place.",
  "repo": "raduwolf12/wiki-place-context",
  "type": "widget",
  "icon": "BookOpen",
  "versions": [
    {
      "version": "1.1.2",
      "gitTag": "v1.1.2",
      "commitSha": "c4bf09730c3476b467338245319ecb7e22eb575e",
      "downloadUrl": "https://github.com/raduwolf12/wiki-place-context/releases/download/v1.1.2/plugin.zip",
      "sha256": "81e7877ab2840a8a6fbe7102d549d749dc027efe4beca660791b85539551a7f7",
      "trek": ">=3.3.0 <5.0.0",
      "size": 18437,
      "apiVersion": 1,
      "nativeModules": false,
      "publishedAt": "2026-08-24T15:12:53.675Z"
    },
    {
      "version": "1.1.1",
      "gitTag": "v1.1.1",
      "commitSha": "aa1c0cf1c764de49d42bf8946234beed545d925c",
      "downloadUrl": "https://github.com/raduwolf12/wiki-place-context/releases/download/v1.1.1/plugin.zip",
      "sha256": "5592fb4bb82e46427ce4497413e56e5b82742ce375fb83c220caf1fb90a4464d",
      "trek": ">=3.3.0 <4.1.0",
      "size": 18437,
      "apiVersion": 1,
      "nativeModules": false,
      "publishedAt": "2026-08-18T15:49:24.117Z"
    },
    {
      "version": "1.1.0",
      "gitTag": "v1.1.0",
      "commitSha": "5b01ea7791e2587205c49e009c27970653e327d5",
      "downloadUrl": "https://github.com/raduwolf12/wiki-place-context/releases/download/v1.1.0/plugin.zip",
      "sha256": "dee0c4285765c71f89288e8b4a5a1468e5a7b51bf513265d1927ec71a8aba0f5",
      "trek": ">=3.3.0 <4.0.0",
      "size": 18417,
      "apiVersion": 1,
      "nativeModules": false,
      "publishedAt": "2026-07-20T20:18:51.436Z"
    },
    {
      "version": "1.0.0",
      "gitTag": "v1.0.0",
      "commitSha": "900bda7ffdf8da38bac9da4f7112fd108fec63a1",
      "downloadUrl": "https://github.com/raduwolf12/wiki-place-context/releases/download/v1.0.0/plugin.zip",
      "sha256": "c92e514dc5a6274680547282abed58c0aeb85bfc6a56c7394aa93ad254aadad7",
      "trek": ">=3.2.0 <4.0.0",
      "minTrekVersion": "3.2.0",
      "size": 13962,
      "apiVersion": 1,
      "nativeModules": false,
      "publishedAt": "2026-07-08T19:23:03.644Z"
    }
  ],
  "homepage": "https://github.com/raduwolf12/wiki-place-context",
  "reviewedAt": "2026-08-20",
  "boundOwner": "raduwolf12"
}
