{
  "id": "community-trips",
  "name": "Community Trips",
  "author": "raduwolf12",
  "description": "Browse real trips other TREK admins have shared, discuss them, and share your own — reviewed via a GitHub pull request, with a Discussion thread for suggestions.",
  "repo": "raduwolf12/community-trips",
  "type": "page",
  "versions": [
    {
      "version": "1.0.2",
      "gitTag": "v1.0.2",
      "commitSha": "2ed71eb258a8ac0d5bc3019f0c9eb30c18f729ee",
      "downloadUrl": "https://github.com/raduwolf12/community-trips/releases/download/v1.0.2/plugin.zip",
      "sha256": "79df06be5a982987f0763405847c951d742e3d25090b51d3aaa2a37c355975d5",
      "trek": ">=3.4.0 <5.0.0",
      "size": 88271,
      "apiVersion": 1,
      "nativeModules": false,
      "publishedAt": "2026-08-24T15:02:25.796Z",
      "signature": "/Y/Sk8P8hBOurQHG8V+sZCcyB6M2RKHfVHSHN8GHGcTYK/67jsvAUNTyLw1JtDFSuyTGUOXNGsK8O7i+utBgCw=="
    },
    {
      "version": "1.0.1",
      "gitTag": "v1.0.1",
      "commitSha": "f3c9947eb3413197c22f7832cd69dd4281766c6d",
      "downloadUrl": "https://github.com/raduwolf12/community-trips/releases/download/v1.0.1/plugin.zip",
      "sha256": "e37c94f38f02ce243a371308b3d315f13ebdbb9b9de6fc96dbc555eca49b078d",
      "trek": ">=3.4.0 <4.1.0",
      "size": 88272,
      "apiVersion": 1,
      "nativeModules": false,
      "publishedAt": "2026-08-18T15:49:32.480Z",
      "signature": "/1acY6H/KGvggr3eMlPLbwJikJ5lgCAz76jyqrNuf2+WlSxkQerYJJBPuyx3kaD0qhXhQN+CpF46p9d31QAwBw=="
    },
    {
      "version": "1.0.0",
      "gitTag": "v1.0.0",
      "commitSha": "95a6db3660dde768907d6f837eeb20f5ed16fe5f",
      "downloadUrl": "https://github.com/raduwolf12/community-trips/releases/download/v1.0.0/plugin.zip",
      "sha256": "b7e0a3bd5bf5965578e1e5f3e6dc1ab168ef5190286e7f8732dd73d790cf0220",
      "trek": ">=3.4.0 <4.0.0",
      "size": 88269,
      "apiVersion": 1,
      "nativeModules": false,
      "publishedAt": "2026-08-16T11:00:17.629Z",
      "signature": "jfC/W7rFRJ8DPs2EHIOQCkbKDHtA9cCfwJ3aNr352pdswBtKGTi0HpxSnPOpcVD/bafNU+nUEPFIyU03QkOdAA=="
    }
  ],
  "icon": "Users",
  "authorPublicKey": "uMHwp7oHtdz7DIpkW4H0yZFMuyAxmVajzKh4079jiwA=",
  "reviewedAt": "2026-08-20",
  "boundOwner": "raduwolf12"
}
