{
  "id": "trip-importer",
  "name": "Trip Importer",
  "author": "raduwolf12",
  "description": "Reconstruct past trips from Polarsteps, GPS photos, booking PDFs/ICS, expense CSVs and Google Timeline — auto-creates the trip, journal, places, bookings and costs, with multi-trip detection and undo.",
  "repo": "raduwolf12/trip-importer",
  "type": "page",
  "versions": [
    {
      "version": "1.4.1",
      "gitTag": "v1.4.1",
      "commitSha": "d6f7bca3e0d9026f7eedbb409fb6e3343a433eaf",
      "downloadUrl": "https://github.com/raduwolf12/trip-importer/releases/download/v1.4.1/plugin.zip",
      "sha256": "5640befe4c8e312ae122c404562547b9b3b797832712ebe37930fc7cde49a846",
      "trek": ">=3.4.0 <5.0.0",
      "size": 552701,
      "apiVersion": 1,
      "nativeModules": false,
      "publishedAt": "2026-08-24T15:05:20.062Z",
      "operatorEgress": true,
      "signature": "zPltzjY8VT1DjkvlfDkmQwc5nYTZS8JEComq1sd3Ew4eQ9+71/Ooa2bWywwqQJ/w3CLf0md7QNMWbbHdbD3lCA=="
    },
    {
      "version": "1.4.0",
      "gitTag": "v1.4.0",
      "commitSha": "c349c5825ad9d556679eb3fc2f288a2e9a47a8db",
      "downloadUrl": "https://github.com/raduwolf12/trip-importer/releases/download/v1.4.0/plugin.zip",
      "sha256": "06f0b1c16d810d5006abe1dc0ae411e6ad49283d5568498687b350f7a916352e",
      "trek": ">=3.4.0 <4.1.0",
      "size": 552697,
      "apiVersion": 1,
      "nativeModules": false,
      "operatorEgress": true,
      "publishedAt": "2026-08-22T09:22:16Z"
    },
    {
      "version": "1.3.2",
      "gitTag": "v1.3.2",
      "commitSha": "d3fe7d1288e0bd1448ffc18a6a68156a9fe169cb",
      "downloadUrl": "https://github.com/raduwolf12/trip-importer/releases/download/v1.3.2/plugin.zip",
      "sha256": "32ae5b84b56ce4e2f0ff505833ed56786ba24cece767fa92ad746f06ed8f6e96",
      "trek": ">=3.4.0 <4.1.0",
      "size": 540484,
      "apiVersion": 1,
      "nativeModules": false,
      "publishedAt": "2026-08-18T15:49:27.329Z"
    },
    {
      "version": "1.3.1",
      "gitTag": "v1.3.1",
      "commitSha": "e02f0710a66fd2c707c2e0fedd1a27a95b94add9",
      "downloadUrl": "https://github.com/raduwolf12/trip-importer/releases/download/v1.3.1/plugin.zip",
      "sha256": "39b764d21088cd50bf36de237e81591a6340c64d6ca1aa3f79379adc52309867",
      "trek": ">=3.4.0 <4.0.0",
      "size": 540485,
      "apiVersion": 1,
      "nativeModules": false,
      "publishedAt": "2026-08-16T10:35:03.000Z"
    },
    {
      "version": "1.3.0",
      "gitTag": "v1.3.0",
      "commitSha": "3c3f75722a01915fc2468eda4bea47f4a2720e89",
      "downloadUrl": "https://github.com/raduwolf12/trip-importer/releases/download/v1.3.0/plugin.zip",
      "sha256": "e12bf562fb32529827c88961747bcbe5dd14ec274300554a63cca0edc88f66ef",
      "trek": ">=3.4.0 <4.0.0",
      "size": 538212,
      "apiVersion": 1,
      "nativeModules": false,
      "publishedAt": "2026-08-14T23:44:27.877Z"
    },
    {
      "version": "1.2.3",
      "gitTag": "v1.2.3",
      "commitSha": "ff8e6419b641d0dc8241742b06c81d827025c0b1",
      "downloadUrl": "https://github.com/raduwolf12/trip-importer/releases/download/v1.2.3/plugin.zip",
      "sha256": "be463ee461c3fb0d72d4d4e59c3db686d647cb9c12508ce54939bbb0d26f5314",
      "trek": ">=3.4.0 <4.0.0",
      "size": 534962,
      "apiVersion": 1,
      "nativeModules": false,
      "publishedAt": "2026-08-12T20:08:30.094Z"
    },
    {
      "version": "1.2.0",
      "gitTag": "v1.2.0",
      "commitSha": "bdd135308fed829ad776f8125d29dcd994dab376",
      "downloadUrl": "https://github.com/raduwolf12/trip-importer/releases/download/v1.2.0/plugin.zip",
      "sha256": "351083273f6701c6e1b234876e86d280997ef6037ebf623931eab150deb89813",
      "trek": ">=3.4.0 <4.0.0",
      "size": 532373,
      "apiVersion": 1,
      "nativeModules": false,
      "publishedAt": "2026-07-21T16:37:31.683Z"
    },
    {
      "version": "1.0.0",
      "gitTag": "v1.0.0",
      "commitSha": "a008ec401ee8363e8d0ab758da240896c07ead28",
      "downloadUrl": "https://github.com/raduwolf12/trip-importer/releases/download/v1.0.0/plugin.zip",
      "sha256": "4965317ca31804702dc98af5f823b100c9fc76b08692f189da51f83351275b81",
      "trek": ">=3.4.0 <4.0.0",
      "size": 521183,
      "apiVersion": 1,
      "nativeModules": false,
      "publishedAt": "2026-07-20T21:59:57.814Z"
    }
  ],
  "icon": "PackageOpen",
  "reviewedAt": "2026-08-20",
  "boundOwner": "raduwolf12",
  "authorPublicKey": "uMHwp7oHtdz7DIpkW4H0yZFMuyAxmVajzKh4079jiwA="
}
