{
  "id": "koffi",
  "name": "Koffi & Friends",
  "author": "TREK",
  "description": "The TREK mascot troupe on your boarding pass: Koffi the suitcase, Chiki the snack, Passi the passport, Puffi the neck pillow. Pick one, or a duo that naps and stamps together.",
  "repo": "mauriceboe/trek-plugin-koffi",
  "homepage": "https://github.com/mauriceboe/trek-plugin-koffi",
  "tags": [
    "widget",
    "mascot",
    "fun"
  ],
  "type": "widget",
  "icon": "Luggage",
  "authorPublicKey": "4QeCOm8gMfcoZdjIznao2KV10NSS7u/0AYn+6FA6/Oo=",
  "versions": [
    {
      "version": "2.0.0",
      "gitTag": "v2.0.0",
      "commitSha": "68de9063fb76f0cd5e6a0d855f3eaac04327b941",
      "downloadUrl": "https://github.com/mauriceboe/trek-plugin-koffi/releases/download/v2.0.0/plugin.zip",
      "sha256": "1915d08ade998599ed68d3571c2a6317dd9b868cdf728454b0131bea736043d4",
      "trek": ">=3.5.0",
      "size": 57289,
      "apiVersion": 1,
      "nativeModules": false,
      "publishedAt": "2026-08-27T20:35:19.783Z",
      "signature": "E1bJc8dicFstPL7hduwFnPH01gO7I4R6wp9vpx+TYB+dyxGF9aGn90OLFnBBsXtexdjOs0GMIJTO5LmRLIlqDQ=="
    },
    {
      "version": "1.0.1",
      "gitTag": "v1.0.1",
      "commitSha": "fedcf81d2fc13a331fdfa49662fcbef9c3d51fb8",
      "downloadUrl": "https://github.com/mauriceboe/trek-plugin-koffi/releases/download/v1.0.1/plugin.zip",
      "sha256": "bb475f519769c757a6e28f00ae8cf1ef401c512d4dc39c65589ce8743d2c1315",
      "trek": ">=3.2.0 <4.0.0",
      "minTrekVersion": "3.2.0",
      "maxTrekVersion": null,
      "size": 943257,
      "apiVersion": 1,
      "nativeModules": false,
      "publishedAt": "2026-07-04T00:00:00Z",
      "signature": "3RFXzYdBrq1hq7gErVrgEhO9LlTaxXHLcrGrMZ/hggQeW5hxIbAmxOzVcmbDGDQL6KhzuvzJsq117QbctmpuAQ=="
    },
    {
      "version": "1.0.0",
      "gitTag": "v1.0.0",
      "commitSha": "749db9fb2e229f3f36dbfc2d81e33a821a55c359",
      "downloadUrl": "https://github.com/mauriceboe/trek-plugin-koffi/releases/download/v1.0.0/plugin.zip",
      "sha256": "3172d9b240ef4de3b0c2465a9f59096bd01cb6af93527580af8445fab0f1752c",
      "trek": ">=3.2.0 <4.0.0",
      "minTrekVersion": "3.2.0",
      "maxTrekVersion": null,
      "size": 215481,
      "apiVersion": 1,
      "nativeModules": false,
      "publishedAt": "2026-07-03T00:00:00Z",
      "signature": "buuArBwQj3WrLoz1UYIZRl/id4o/KCvqqXZQo7vV+sgfk7yl8MAv7J4IAQLDaiHXTJBnMt7s4bzhnnzqclTNBA=="
    }
  ],
  "reviewedAt": "2026-07-18",
  "boundOwner": "mauriceboe"
}
