{
  "id": "trip-gallery",
  "name": "Trip Gallery",
  "author": "raduwolf12",
  "description": "Shared photo gallery for your trip, with automatic HEIC conversion.",
  "repo": "raduwolf12/trip-gallery",
  "type": "trip-page",
  "versions": [
    {
      "version": "1.0.1",
      "gitTag": "v1.0.1",
      "commitSha": "e5281a07a3c3a149e43ab4a8e34ba6ee6be6271e",
      "downloadUrl": "https://github.com/raduwolf12/trip-gallery/releases/download/v1.0.1/plugin.zip",
      "sha256": "2b8e690f59756dd5abb26e7a3c63128ce90ebfd3e69e34e9ee1cb2dbc8e47750",
      "trek": ">=3.4.0 <4.1.0",
      "size": 358749,
      "apiVersion": 1,
      "nativeModules": false,
      "publishedAt": "2026-08-18T15:49:28.978Z"
    },
    {
      "version": "1.0.0",
      "gitTag": "v1.0.0",
      "commitSha": "ad09889d92540a4a46697f66d65995e7bc5bdbed",
      "downloadUrl": "https://github.com/raduwolf12/trip-gallery/releases/download/v1.0.0/plugin.zip",
      "sha256": "233a9229d81177a5b7dbc8097033ec1de3c17a9be0942d617fa667fc671eb32f",
      "trek": ">=3.4.0 <4.0.0",
      "size": 358747,
      "apiVersion": 1,
      "nativeModules": false,
      "publishedAt": "2026-07-29T16:46:17.845Z"
    }
  ],
  "icon": "Images",
  "reviewedAt": "2026-07-29",
  "boundOwner": "raduwolf12"
}
